{
  "schema_version": "1.0",
  "task_id": "guided-watch",
  "agent": "creative",
  "round_no": 1,
  "attempt_count": 1,
  "requirements": {
    "product_name": "智能手表",
    "product_description": "支持消息提醒和运动记录。\n\n已确认的产品特点：\n可查看历史运动记录。\n\n【智策需求补充 v1】\n{\"formVersion\":1,\"productCategory\":\"数码产品\",\"productDescription\":\"支持消息提醒和运动记录。\",\"productFeatures\":\"可查看历史运动记录。\",\"priceStatus\":\"unknown\",\"priceInfo\":\"\",\"salesScope\":\"线上销售\",\"salesRegion\":\"\",\"purchaseStatus\":\"unknown\",\"purchaseEntry\":\"\"}",
    "marketing_goal": "首要目标：建立产品认知\n希望用户采取的行动：咨询产品详情\n目标补充：了解消息提醒使用场景\n\n【智策需求补充 v1】\n{\"formVersion\":1,\"primaryGoal\":\"建立产品认知\",\"marketingGoal\":\"了解消息提醒使用场景\",\"desiredAction\":\"咨询产品详情\",\"actionDetail\":\"\"}",
    "target_audience": "通勤人群",
    "budget": {
      "amount": 1000,
      "currency": "CNY"
    },
    "campaign_period": {
      "duration_days": 14
    },
    "special_requirements": "不虚构优惠、认证、销量或效果承诺\n\n【智策需求补充 v1】\n{\"formVersion\":1,\"audienceMode\":\"known\",\"marketingProblem\":\"产品差异讲不清楚\",\"problemDetail\":\"\",\"channelsState\":\"unknown\",\"existingChannels\":\"\",\"materialsState\":\"unknown\",\"availableMaterials\":\"\",\"teamState\":\"unknown\",\"teamResources\":\"\",\"constraintStatus\":\"known\",\"brandStyle\":\"清楚直接\"}",
    "budget_raw": "1000 CNY"
  },
  "strategy": {
    "schema_version": "1.0",
    "task_id": "guided-watch",
    "agent": "strategy",
    "round_no": 1,
    "attempt_count": 1,
    "status": "succeeded",
    "result_id": "strategy-a54b52f823f14452aab2d44d6a0bdf85",
    "version": 1,
    "data": {
      "target_audience": {
        "segment": "通勤人群",
        "needs": [
          "待验证假设：在了解或比较智能手表时，判断“支持消息提醒和运动记录”是否符合自身需要"
        ],
        "pain_points": [
          "待验证假设：如果“支持消息提醒和运动记录”没有被清楚呈现，可能难以判断智能手表是否值得进一步了解"
        ],
        "age_range": null,
        "occupation": null,
        "basis": "用户明确指定目标人群为通勤人群"
      },
      "positioning": "面向通勤人群，在了解和比较产品的决策情境中，以“支持消息提醒和运动记录”这一已知特点呈现智能手表，服务“首要目标：建立产品认知\n希望用户采取的行动：咨询产品详情\n目标补充：了解消息提醒使用场景\n\n【智策需求补充 v1】\n{\"formVersion\":1,\"primaryGoal\":\"建立产品认知\",\"marketingGoal\":\"了解消息提醒使用场景\",\"desiredAction\":\"咨询产品详情\",\"actionDetail\":\"\"}”",
      "selling_points": [
        {
          "claim": "支持消息提醒和运动记录",
          "source_quote": "支持消息提醒和运动记录"
        }
      ],
      "channels": [
        {
          "name": "科技内容平台",
          "reason": "待验证假设：智能手表可围绕“支持消息提醒和运动记录”制作可核对的产品信息；选择科技内容平台是为了向通勤人群传达这些信息并服务“首要目标：建立产品认知\n希望用户采取的行动：咨询产品详情\n目标补充：了解消息提醒使用场景\n\n【智策需求补充 v1】\n{\"formVersion\":1,\"primaryGoal\":\"建立产品认知\",\"marketingGoal\":\"了解消息提醒使用场景\",\"desiredAction\":\"咨询产品详情\",\"actionDetail\":\"\"}”，实际适配程度需验证",
          "content_direction": "内容：制作围绕“支持消息提醒和运动记录”的产品介绍；发布：以图文或短内容形式通过科技内容平台发布并引导了解产品；执行前核实：确认发布权限、可用素材与产品信息仍然有效；预算用途：用于内容素材制作、发布准备和小范围验证，不代表渠道市场报价",
          "allocated_amount": 1000.0
        }
      ],
      "marketing_strategy": {
        "theme": "用可核对的产品信息帮助通勤人群了解智能手表",
        "content_directions": [
          "内容主张：智能手表提供“支持消息提醒和运动记录”；事实依据：“支持消息提醒和运动记录”；表现形式：产品信息图文或短视频；行动引导：进一步了解或咨询产品信息"
        ],
        "promotion_methods": [
          "执行动作：准备产品信息素材，通过科技内容平台发布并记录真实反馈；核实：发布权限、素材准确性和渠道规则"
        ]
      },
      "assumptions": [
        "通勤人群会关注“支持消息提醒和运动记录”所表达的产品信息，此判断需通过真实反馈验证"
      ],
      "missing_information": [
        "执行前需确认科技内容平台的账号或发布权限，以及可使用的智能手表产品素材"
      ],
      "constraint_conflicts": []
    },
    "error": null,
    "created_at": "2026-10-12T04:08:32.778087Z"
  },
  "creative": null,
  "feedback": [],
  "previous_result": null,
  "config_version": "synthetic-offline-handoff-v1"
}
